{
  "$schema": "http://json-schema.org/draft-07/schema#",
  "$id": "hermesos_state/v1",
  "title": "HermesAgentOS StartUpTools state",
  "type": "object",
  "required": ["schema_version", "name", "version"],
  "properties": {
    "schema_version": { "const": "hermesos_state/v1" },
    "name": { "type": "string" },
    "version": { "type": "string" },
    "generated_at": { "type": "string" },
    "evidence_boundaries": {
      "type": "object",
      "properties": {
        "classes": {
          "type": "array",
          "items": { "enum": ["OBSERVED", "SNAPSHOT", "UNVERIFIED"] }
        }
      }
    },
    "environment": { "type": "object" },
    "target_stack": { "type": "object" },
    "catalog_verified_after_install": {
      "type": "object",
      "properties": {
        "installable_skills": { "type": "integer", "minimum": 0 },
        "role_directories": { "type": "integer", "minimum": 0 },
        "capability_families": { "type": "integer", "minimum": 0 }
      }
    },
    "memory_layout_verified": { "type": "object" },
    "bugs_found_and_fixed": { "type": "object" },
    "deliverables": { "type": "object" },
    "open_items": { "type": "object" },
    "model_routing_readiness_verified": { "type": "object" }
  },
  "additionalProperties": true
}
